{"$defs":{"EventClass":{"description":"What a journal event records.\n\nThe split matters after registration: `action_request` and\n`action_receipt` are cache entries and stay legal; everything else would\nbe the journal asserting a fact of its own.","enum":["draft_history","action_request","action_receipt"],"type":"string"}},"$id":"oh.war/journal-event/v1","$schema":"https://json-schema.org/draft/2020-12/schema","description":"§66.3's event envelope.\n\nThere is deliberately no `recorded_at`: §66.3 says the local clock is not\nauthoritative for it, and a field that cannot be filled correctly should not\nexist to be filled at all.","properties":{"actor_ref":{"type":"string"},"class":{"$ref":"#/$defs/EventClass"},"id":{"type":"string"},"idempotency_key":{"default":"","type":"string"},"occurred_at":{"description":"When the thing happened, by the local clock. NOT `recorded_at`.","type":"string"},"payload":{"default":"","type":"string"},"type":{"type":"string"},"v":{"format":"uint32","minimum":0,"type":"integer"},"warrant_uuid":{"type":"string"}},"required":["v","id","warrant_uuid","type","class","actor_ref","occurred_at"],"title":"JournalEvent","type":"object"}
