{
  "v": 1,
  "id": "01a0f001-0000-7000-8000-000000000002",
  "warrant_uuid": "01a0e1c2-0b7d-7c11-8f2e-5d6c7b8a9e10",
  "type": "ticket.claimed",
  "class": "action_receipt",
  "actor_ref": "claude",
  "occurred_at": "2026-10-12T09:00:00Z",
  "payload": "{\"claim\":\"c-1\",\"since\":\"2026-10-12T09:00:00Z\",\"target\":\"t-0d61d/i-9c01\"}",
  "idempotency_key": "e0106d80a16b31d6ae28a3e73093747b4f81520a3629ecfab397def32b80acba"
}
